{
  "$schema": "https://json-schema.org/draft/2020-12/schema",
  "type": "object",
  "additionalProperties": false,
  "required": [
    "schema_version",
    "experiment_id",
    "model_id",
    "parameters",
    "units",
    "seeds",
    "resources",
    "analysis",
    "report"
  ],
  "properties": {
    "schema_version": {
      "const": "research-experiment-v1"
    },
    "experiment_id": {
      "const": "gross.reconstruction.v1"
    },
    "model_id": {
      "const": "signal-space.ss-ocf-1.flat-neutral-clock.v1"
    },
    "parameters": {
      "const": {
        "epsilon": 0.2,
        "kind": "reconstruction",
        "amplitude": 0.012,
        "omega_chi": 0.41274991,
        "local_radius": 0.1,
        "upstream_radius": 14.0,
        "duration": 60.0,
        "acquisition_duration": 16.0,
        "sample_interval": 0.0125,
        "support": [18.0, 26.0],
        "cutoff": 1e-10,
        "alternate_cutoff": 1e-8,
        "surface_relative_tolerance": 1e-10,
        "input_radius_factor": 2.0,
        "marker_threshold": 0.0001,
        "timing_target": 0.0001,
        "floor": 1e-7,
        "variants": [
          {
            "name": "coarse",
            "h": 0.05,
            "dt": 0.0025,
            "radius": 80,
            "profile": "research/experiments/gross.reception-transfer.v1/run-941d5c9e1c37ccc8/attempts/attempt-0001/raw/profile-fine.npz"
          },
          {
            "name": "fine",
            "h": 0.025,
            "dt": 0.0025,
            "radius": 80,
            "profile": "research/experiments/gross.reception-transfer.v1/run-941d5c9e1c37ccc8/attempts/attempt-0001/raw/profile-finer.npz"
          },
          {
            "name": "finest",
            "h": 0.0125,
            "dt": 0.0025,
            "radius": 80,
            "profile": "research/experiments/gross.reception-transfer.v1/run-941d5c9e1c37ccc8/attempts/attempt-0001/raw/profile-finest.npz"
          },
          {
            "name": "time",
            "h": 0.0125,
            "dt": 0.00125,
            "radius": 80,
            "profile": "research/experiments/gross.reception-transfer.v1/run-941d5c9e1c37ccc8/attempts/attempt-0001/raw/profile-finest.npz"
          },
          {
            "name": "wide",
            "h": 0.025,
            "dt": 0.0025,
            "radius": 100,
            "profile": "research/experiments/gross.reception-transfer.v1/run-941d5c9e1c37ccc8/attempts/attempt-0001/raw/profile-wide.npz"
          }
        ],
        "waveforms": [
          {
            "name": "broad",
            "center": 22.0,
            "width": 3.25,
            "carrier": 0.0
          },
          {
            "name": "carrier",
            "center": 22.0,
            "width": 2.5,
            "carrier": 1.4
          },
          {
            "name": "new",
            "center": 21.5,
            "width": 2.75,
            "carrier": 0.8
          }
        ],
        "frozen_inputs": [
          {
            "path": "research/experiments/gross.reception-transfer.v1/run-941d5c9e1c37ccc8/attempts/attempt-0001/raw/profile-fine.npz",
            "sha256": "4f34964bd2dc7080a8b742e0fc1947f2031723dbd17909349a7187d9af896d10"
          },
          {
            "path": "research/experiments/gross.reception-transfer.v1/run-941d5c9e1c37ccc8/attempts/attempt-0001/raw/profile-finer.npz",
            "sha256": "c67ce8067b56f38c8edc7e4933f55e7d6fe468bca99d1ac62c2f36627c0cca06"
          },
          {
            "path": "research/experiments/gross.reception-transfer.v1/run-941d5c9e1c37ccc8/attempts/attempt-0001/raw/profile-finest.npz",
            "sha256": "33a5e236f7ae5992704966f4cc2e83f1a4a1f397b5baadb9641988c3d35c1ff9"
          },
          {
            "path": "research/experiments/gross.reception-transfer.v1/run-941d5c9e1c37ccc8/attempts/attempt-0001/raw/profile-wide.npz",
            "sha256": "18702858e8f68fdbff279f1b6117dd7f55336e6f7f084eae9a00f4154a0dde02"
          },
          {
            "path": "research/papers/gross-operator-program-v0.2.md",
            "sha256": "c733c958fde54c810c38889e5096de54358a77cc10e69d9f885870832595e123"
          },
          {
            "path": "docs/research/gross-test-07-transfer-results.md",
            "sha256": "f2c4e4cb741bde289784f7e0c2115947352d710888ceeba15cc07e4103c2f1bb"
          }
        ]
      }
    },
    "units": {
      "const": {
        "mass": "m=1",
        "length": "m^-1",
        "time": "m^-1",
        "signal": "c=hbar=1"
      }
    },
    "seeds": {
      "const": {
        "root": 202609260
      }
    },
    "resources": {
      "type": "object",
      "additionalProperties": false,
      "required": [
        "max_cpu_seconds",
        "max_wall_seconds",
        "max_memory_mb",
        "max_output_mb"
      ],
      "properties": {
        "max_cpu_seconds": {
          "type": "integer",
          "minimum": 1
        },
        "max_wall_seconds": {
          "type": "integer",
          "minimum": 1
        },
        "max_memory_mb": {
          "type": "integer",
          "minimum": 1
        },
        "max_output_mb": {
          "type": "integer",
          "minimum": 1
        }
      }
    },
    "analysis": {
      "const": {
        "prediction-first": "Each variant locks both reconstruction forecasts and sensitivities before its known-source interior audit; every frozen input and forecast hash verifies.",
        "decomposition": "Every source-minus-inverse local history equals the separately propagated retained plus discarded input error to relative 1e-8, with absolute floor 1e-10.",
        "surface-replay": "All synthetic single-site inverse replay residuals are below 1e-7. This check alone does not establish interior observability.",
        "inverse-observability": "Each finest event conditional first-order timing bound is <=1e-4 and no admissible finite singular-direction witness exceeds 1e-4. A witness beyond target rejects robustness; a bound above target without witness is unresolved.",
        "causal-capture": "Every variant causal capture state differs from the projected acquired state by <1e-6 in relative quadratic energy. This excludes omitted exterior energy, which is reported separately.",
        "causal-timing": "For all three spectra each finest causal first/last timing residual is <=1e-4 and the separate residual budget B (mesh residual change + time residual change + domain residual change + surface/output sampling +1e-7) is <=1e-4; require residual <=B. Missing markers or B>target is unresolved, resolved violation fails.",
        "continuum-events": "For both methods and source reference, each finest absolute event mesh change is <=0.6 preceding change plus time/domain/sampling differences and 1e-7; otherwise unresolved. No absolute continuum timing accuracy is implied.",
        "sampling": "Each finest event changes <=1e-4 under output decimation .0125 to .025; causal surface sampling .0125 to .025 is separately <=1e-4. Otherwise unresolved.",
        "source-energy": "Frozen unforced acquisition conserves its quadratic neutral energy to relative 1e-6 over t=0..16 on every grid and waveform. No clock radiation is inferred."
      }
    },
    "report": {
      "const": {
        "title": "Test 7 reconstruction observability and separate event timing"
      }
    }
  }
}
