{"analysis":{"causal-capture":"Every variant causal capture state differs from the projected acquired state by <1e-6 in relative quadratic energy. This excludes omitted exterior energy, which is reported separately.","causal-timing":"For all three spectra each finest causal first/last timing residual is <=1e-4 and the separate residual budget B (mesh residual change + time residual change + domain residual change + surface/output sampling +1e-7) is <=1e-4; require residual <=B. Missing markers or B>target is unresolved, resolved violation fails.","continuum-events":"For both methods and source reference, each finest absolute event mesh change is <=0.6 preceding change plus time/domain/sampling differences and 1e-7; otherwise unresolved. No absolute continuum timing accuracy is implied.","decomposition":"Every source-minus-inverse local history equals the separately propagated retained plus discarded input error to relative 1e-8, with absolute floor 1e-10.","inverse-observability":"Each finest event conditional first-order timing bound is <=1e-4 and no admissible finite singular-direction witness exceeds 1e-4. A witness beyond target rejects robustness; a bound above target without witness is unresolved.","prediction-first":"Each variant locks both reconstruction forecasts and sensitivities before its known-source interior audit; every frozen input and forecast hash verifies.","sampling":"Each finest event changes <=1e-4 under output decimation .0125 to .025; causal surface sampling .0125 to .025 is separately <=1e-4. Otherwise unresolved.","source-energy":"Frozen unforced acquisition conserves its quadratic neutral energy to relative 1e-6 over t=0..16 on every grid and waveform. No clock radiation is inferred.","surface-replay":"All synthetic single-site inverse replay residuals are below 1e-7. This check alone does not establish interior observability."},"experiment_id":"gross.reconstruction.v1","model_id":"signal-space.ss-ocf-1.flat-neutral-clock.v1","parameters":{"acquisition_duration":16.0,"alternate_cutoff":1e-08,"amplitude":0.012,"cutoff":1e-10,"duration":60.0,"epsilon":0.2,"floor":1e-07,"frozen_inputs":[{"path":"research/experiments/gross.reception-transfer.v1/run-941d5c9e1c37ccc8/attempts/attempt-0001/raw/profile-fine.npz","sha256":"4f34964bd2dc7080a8b742e0fc1947f2031723dbd17909349a7187d9af896d10"},{"path":"research/experiments/gross.reception-transfer.v1/run-941d5c9e1c37ccc8/attempts/attempt-0001/raw/profile-finer.npz","sha256":"c67ce8067b56f38c8edc7e4933f55e7d6fe468bca99d1ac62c2f36627c0cca06"},{"path":"research/experiments/gross.reception-transfer.v1/run-941d5c9e1c37ccc8/attempts/attempt-0001/raw/profile-finest.npz","sha256":"33a5e236f7ae5992704966f4cc2e83f1a4a1f397b5baadb9641988c3d35c1ff9"},{"path":"research/experiments/gross.reception-transfer.v1/run-941d5c9e1c37ccc8/attempts/attempt-0001/raw/profile-wide.npz","sha256":"18702858e8f68fdbff279f1b6117dd7f55336e6f7f084eae9a00f4154a0dde02"},{"path":"research/papers/gross-operator-program-v0.2.md","sha256":"c733c958fde54c810c38889e5096de54358a77cc10e69d9f885870832595e123"},{"path":"docs/research/gross-test-07-transfer-results.md","sha256":"f2c4e4cb741bde289784f7e0c2115947352d710888ceeba15cc07e4103c2f1bb"}],"input_radius_factor":2.0,"kind":"reconstruction","local_radius":0.1,"marker_threshold":0.0001,"omega_chi":0.41274991,"sample_interval":0.0125,"support":[18.0,26.0],"surface_relative_tolerance":1e-10,"timing_target":0.0001,"upstream_radius":14.0,"variants":[{"dt":0.0025,"h":0.05,"name":"coarse","profile":"research/experiments/gross.reception-transfer.v1/run-941d5c9e1c37ccc8/attempts/attempt-0001/raw/profile-fine.npz","radius":80},{"dt":0.0025,"h":0.025,"name":"fine","profile":"research/experiments/gross.reception-transfer.v1/run-941d5c9e1c37ccc8/attempts/attempt-0001/raw/profile-finer.npz","radius":80},{"dt":0.0025,"h":0.0125,"name":"finest","profile":"research/experiments/gross.reception-transfer.v1/run-941d5c9e1c37ccc8/attempts/attempt-0001/raw/profile-finest.npz","radius":80},{"dt":0.00125,"h":0.0125,"name":"time","profile":"research/experiments/gross.reception-transfer.v1/run-941d5c9e1c37ccc8/attempts/attempt-0001/raw/profile-finest.npz","radius":80},{"dt":0.0025,"h":0.025,"name":"wide","profile":"research/experiments/gross.reception-transfer.v1/run-941d5c9e1c37ccc8/attempts/attempt-0001/raw/profile-wide.npz","radius":100}],"waveforms":[{"carrier":0.0,"center":22.0,"name":"broad","width":3.25},{"carrier":1.4,"center":22.0,"name":"carrier","width":2.5},{"carrier":0.8,"center":21.5,"name":"new","width":2.75}]},"report":{"title":"Test 7 reconstruction observability and separate event timing"},"resources":{"max_cpu_seconds":4000,"max_memory_mb":2048,"max_output_mb":300,"max_wall_seconds":4500},"schema_version":"research-experiment-v1","seeds":{"root":202609260},"units":{"length":"m^-1","mass":"m=1","signal":"c=hbar=1","time":"m^-1"}}
